{
  "bundle_version": "1.0.0",
  "generated_at": "2026-07-21T17:48:55.002523Z",
  "locale": "hu",
  "source_package_hash": "323ec5e484e1dbbe07df010ea2cac82874445f26cb886187e8f4052fa4aa40f4",
  "translations": {
    "CL-live-approved-frames.entries.0.direction_title": "Alapvonal: nincs új SNI‑politika, a passzív pálya megfigyelése",
    "CL-live-approved-frames.entries.1.direction_title": "Az azonosítási trend és hajtóerőinek ellenőrzése és egyeztetése",
    "CL-live-approved-frames.entries.2.direction_title": "A kategória‑ és beléptetési mechanizmusok áttervezése",
    "CL-live-approved-frames.entries.3.direction_title": "A finanszírozási ösztönzők igazítása a diagnózishoz kötött finanszírozás helyett",
    "CL-live-approved-frames.entries.4.direction_title": "Szakellátási és többségi támogatási kapacitás kiépítése",
    "CL-live-approved-frames.entries.5.direction_title": "A szelekció, a szülői iskolaválasztás és a szegregáció kölcsönhatásainak kezelése",
    "CL-live-approved-frames.entries.6.direction_title": "Az azonosítást befolyásoló kapcsolódó politikaterületek eszközeinek összehangolása",
    "D-live-production-01.decision_question": "Előbb építse-e fel Magyarország az összehangolt monitoring-architektúrát, és csak azután lásson hozzá strukturális vagy finanszírozási reformokhoz, vagy hajtsa végre ezeket párhuzamosan, tekintettel arra, hogy önmagukban az adatok nem változtatják meg a hozzáférést?",
    "D-live-production-01.evidence_boundary": "A dekompozíciós elemzés tisztázhatja, hogy az SNI/BTMN-emelkedés mekkora része tulajdonítható definíciós változásnak, diagnosztikai gyakorlatnak vagy a valódi előfordulásnak, és auditálható alapvonalat állíthat fel. Nem tudja azonban megjósolni, hogy a politikai szereplők reagálnak‑e a kényelmetlen megállapításokra, és nem helyettesítheti a döntést arról sem, hogy a hozzáférés továbbra is diagnózishoz kötött maradjon‑e.",
    "D-live-production-01.tension": "Egy összehangolt mérési architektúra (TP-live-t2) feltárhatja, hogy az azonosítás növekedése mennyiben tükröz diagnosztikai gyakorlatokat, ösztönzőhatásokat vagy definíciós torzításokat a valódi szükséglet helyett; önmagában azonban érintetlenül hagyja az egyetlen országos kaput és a kategóriákhoz kötött jogosultsági rendszert, vagyis az átláthatóság nem fordul át hozzáférésbeli változásokká, ha nincs mellette strukturális vagy finanszírozási reform.",
    "D-live-production-01.title": "Diagnosztikai láthatóság vs. besoroláshoz kötött hozzáférés",
    "D-live-production-01.value_poles.0": "átláthatóság és elszámoltathatóság",
    "D-live-production-01.value_poles.1": "időben történő támogatáshoz való hozzáférés",
    "D-live-production-02.decision_question": "Vállaljon‑e Magyarország ambiciózus szerkezeti átalakítást a kategóriákra/kapuzásra épülő rendszerben a zavarok kockázata ellenére, vagy részesítse előnyben a fokozatos, pilottal ellenőrzött változtatásokat, amelyek megőrzik a stabilitást, de hosszabb ideig hagyhatják megoldatlanul a fő szűk keresztmetszeteket?",
    "D-live-production-02.evidence_boundary": "Az összehasonlító bizonyítékok megmutathatják, hogy hasonló reformok hol és milyen jellegű zavarokat vagy a variációk fennmaradását eredményezték, ezáltal segítik a kockázatbecslést. Nem tudják azonban eldönteni, hogy a magyar szereplők mennyi zavar elviselését tekintik elfogadhatónak a strukturális javulásért cserébe, mivel ez értékítélet az átmeneti költségek elfogadhatóságáról.",
    "D-live-production-02.tension": "Az nem‑kategorizáló, több szintű modellre (TP-live-t3) való áttérés egy dokumentált szűk keresztmetszetet céloz (egyetlen országos kapu, több hónapos várólisták), és csökkentheti a diagnózishoz kötődő hozzáférési akadályokat. Ugyanakkor a lengyel összehasonlító tapasztalatok azt mutatják, hogy a gyors, konszenzus nélküli strukturális reformok súlyos végrehajtási válságokat és szereplői ellenállást idézhetnek elő, míg a finn példa arra utal, hogy a sikeres reformok mellett is megmaradhatnak regionális eltérések.",
    "D-live-production-02.title": "Strukturális kapuzás átalakítása kontra zavarok kockázata",
    "D-live-production-02.value_poles.0": "a hozzáférési mechanizmusok strukturális javítása",
    "D-live-production-02.value_poles.1": "végrehajtási stabilitás és az érintettek támogatása",
    "D-live-production-03.decision_question": "Átalakítsa‑e Magyarország az SNI finanszírozási rendszerét egy ésszerű ösztönzőelmélet alapján annak ellenére, hogy a hazai azonosítási növekedés és a finanszírozás közötti oksági kapcsolat még nincs bizonyítva, vagy várjon erősebb hazai bizonyítékokra, mielőtt megváltoztatná az iskolák jelenleg függő finanszírozási szabályait?",
    "D-live-production-03.evidence_boundary": "További bizonyítékok — például a szabályváltozások körüli természetes kísérletek vagy járási összehasonlítások — tesztelhetik, hogy a magyar multiplikátorok oksági hatással vannak‑e az azonosításra. Nem dönthetik el azonban, hogy a fiskális óvatosság értékét felül kell‑e írnia annak az értéknek, hogy proaktívan megszüntessünk egy valószínű torzítást a bizonyítékok teljes körűsége előtt.",
    "D-live-production-03.tension": "A diagnózisra épülő finanszírozásról a létszám‑alapú finanszírozásra (TP-live-t4) való áttérés azon ésszerű elméleten nyugszik, hogy a pénzügyi ösztönzők túlazonosításhoz vezetnek. Ugyanakkor nincs oksági bizonyíték arra, hogy a magyarországi finanszírozási mechanizmus konkrétan kiváltotta volna az azonosítás növekedését, és a lengyel tapasztalat — ahol a fogyatékosság súlyozását nem eltörölték, hanem kiterjesztették, miközben külön kezelték a kapuzást — azt mutatja, hogy az elméleti kapcsolat nem univerzális.",
    "D-live-production-03.title": "Finanszírozási ösztönzőreform: elméletvezérelt változtatás kontra bizonyítatlan oksági mechanizmus",
    "D-live-production-03.value_poles.0": "a fiskális ösztönzők korrigálása",
    "D-live-production-03.value_poles.1": "óvatosság a nem bizonyított mechanizmusok alapján történő lépésekkel szemben",
    "D-live-production-04.decision_question": "Elégséges‑e önmagában a regionális célzású szakemberbővítés a hozzáférési rések bezárásához, vagy ehhez együtt kell járnia a bejutást szabályozó mechanizmusok és a finanszírozás reformjának annak biztosítására, hogy a megnövelt kapacitás tényleges szolgáltatásnyújtássá alakuljon?",
    "D-live-production-04.evidence_boundary": "A képzési befejezésekre, megtartásra (retenció) és ténylegesen nyújtott fejlesztő/rehabilitációs órákra vonatkozó jövőbeni adatok tisztázhatnák, hogy a munkaerő‑befektetés önmagában átalakul‑e tényleges szolgáltatáshozzáféréssé. Ezek az adatok azonban nem dönthetnek arról, hogy Magyarországnak egyidejű strukturális reformokat is kell‑e folytatnia, mert ez versengő értékítéleteket érint a reformok sorrendjéről és a kockázattűrésről, nem pusztán kapacitásmérést.",
    "D-live-production-04.tension": "A célzott szakember‑állomány bővítése (TP-live-t5) közvetlenül reagál a dokumentált regionális hiányokra és politikailag nagyrészt vitamentes, ugyanakkor a növekvő képzési létszám nem feltétlenül fordítódik gyakorló szakemberekké, és az általános bérreformok sem biztos, hogy elérik a speciális szakember‑ellátást. Felmerül tehát a kérdés, hogy önmagában a kapacitásbővítés képes‑e bezárni a hozzáférési réseket, vagy mélyebb szervezeti átalakításokra illetve a jogosultsági és hozzáférési szabályok strukturális reformjára is szükség van-e.",
    "D-live-production-04.title": "A munkaerő‑bővítés célzása kontra az átfogó reform önmagában való elegendősége",
    "D-live-production-04.value_poles.0": "a kapacitásbővítés mint önmagában elegendő megoldás",
    "D-live-production-04.value_poles.1": "a jogosultsági és hozzáférési szabályok strukturális reformja mint szükséges kiegészítés",
    "D-live-production-05.decision_question": "Kiterjessze‑e az állam a kötelező szegregáció‑ellenes szabályozást a szabad iskolaválasztásra és a szelekciós felvételre a fenntartói autonómia ellenvetései és a várható politikai ellenállás ellenére, vagy korlátozza‑e a beavatkozást kevésbé ellenálló területekre, még akkor is, ha így a szegregációs csatornák szerkezetileg kezeletlenek maradnak?",
    "D-live-production-05.evidence_boundary": "A szegregációs mintákról, beutalási küszöbökről és jogi precedensekről származó bizonyítékok dokumentálhatják a szelekció méretét és mechanizmusait, és előre jelezhetik az ellenállás várható intenzitását. Nem dönthetik el azonban, hogy a szülői választásnak és a fenntartói autonómiának mekkora súlyt kell adni a deszegregációs kötelezettségekhez képest, mert ez normatív egyensúlyozás kérdése, nem pusztán ténykérdés.",
    "D-live-production-05.tension": "A szegregáció‑ellenes védőintézkedések kiterjesztése a szabad iskolaválasztásra és a szelekciós gimnáziumi sávokra (TP-live-t6) közvetlenül a dokumentált, eddig meg nem oldott szelekciós mechanizmusokat célozza, és reagál a megoldatlan EJEB/EU kötelezettségekre. Ugyanakkor ez új jogi felhatalmazást kíván a felvételi és a szolgáltatói autonómia (állami, magán és egyházi) fölött — olyan területeken, ahol több mint egy évtizedes intézményi ellenállás tapasztalható, és külső végrehajtás híján alacsony a tartós jogalkalmazás esélye.",
    "D-live-production-05.title": "Szegregáció‑ellenes koordináció vs. intézményi és fenntartói autonómia",
    "D-live-production-05.value_poles.0": "egyenlő hozzáférés és szegregáció‑ellenes kötelezettségek",
    "D-live-production-05.value_poles.1": "intézményi/fenntartói autonómia és szülői választás",
    "D-live-production-06.decision_question": "Tartson‑e Magyarország szándékosan változatlan alapvonalat a tiszta kontrafaktuális bizonyítékok előállításához, vagy tekintse a folyamatban levő sodródást az ismert strukturális és jogi nyomás alatt önmagában elfogadhatatlan politikai döntésnek, amely azonnali beavatkozást igényel?",